{
  "schemaVersion": "1.0",
  "repo": {
    "name": "history-repo",
    "remoteUrl": null,
    "analyzedAt": "2026-01-01T00:00:00.000Z",
    "defaultBranch": "main",
    "analysisWindowDays": 365,
    "stats": {
      "files": 3,
      "loc": 8,
      "commits": 5,
      "languages": {
        "python": 0.5,
        "typescript": 0.5
      }
    }
  },
  "nodes": [
    {
      "id": "core/",
      "kind": "module",
      "parent": null,
      "path": "core/",
      "layer": "backend",
      "loc": 4,
      "churn": 1,
      "commits": 4,
      "authors": 2,
      "lastChangedAt": "2025-06-30T08:00:00.000Z",
      "description": null,
      "descriptionSource": null
    },
    {
      "id": "core/scoring.py",
      "kind": "file",
      "parent": "core/",
      "path": "core/scoring.py",
      "layer": "backend",
      "loc": 4,
      "churn": 1,
      "commits": 4,
      "authors": 2,
      "lastChangedAt": "2025-06-30T08:00:00.000Z",
      "description": null,
      "descriptionSource": null
    },
    {
      "id": "legacy/",
      "kind": "module",
      "parent": null,
      "path": "legacy/",
      "layer": "backend",
      "loc": 2,
      "churn": 0,
      "commits": 0,
      "authors": 0,
      "lastChangedAt": null,
      "description": null,
      "descriptionSource": null
    },
    {
      "id": "legacy/old.ts",
      "kind": "file",
      "parent": "legacy/",
      "path": "legacy/old.ts",
      "layer": "backend",
      "loc": 2,
      "churn": 0,
      "commits": 0,
      "authors": 0,
      "lastChangedAt": null,
      "description": null,
      "descriptionSource": null
    },
    {
      "id": "web/",
      "kind": "module",
      "parent": null,
      "path": "web/",
      "layer": "frontend",
      "loc": 2,
      "churn": 0.75,
      "commits": 3,
      "authors": 3,
      "lastChangedAt": "2025-05-20T16:45:00.000Z",
      "description": null,
      "descriptionSource": null
    },
    {
      "id": "web/api.ts",
      "kind": "file",
      "parent": "web/",
      "path": "web/api.ts",
      "layer": "frontend",
      "loc": 2,
      "churn": 0.75,
      "commits": 3,
      "authors": 3,
      "lastChangedAt": "2025-05-20T16:45:00.000Z",
      "description": null,
      "descriptionSource": null
    }
  ],
  "edges": [],
  "cochanges": []
}
