{
  "schemaVersion": "1.0",
  "repo": {
    "name": "fixture-module-zero-files",
    "remoteUrl": null,
    "analyzedAt": "2026-01-01T00:00:00.000Z",
    "defaultBranch": "main",
    "analysisWindowDays": 365,
    "stats": {
      "files": 1,
      "loc": 10,
      "commits": 1,
      "languages": {
        "typescript": 1
      }
    }
  },
  "nodes": [
    {
      "id": "app/",
      "kind": "module",
      "parent": null,
      "path": "app/",
      "layer": "backend",
      "loc": 10,
      "churn": 0.1,
      "commits": 1,
      "authors": 1,
      "lastChangedAt": "2025-11-01T10:00:00.000Z",
      "description": null,
      "descriptionSource": null
    },
    {
      "id": "app/entry.ts",
      "kind": "file",
      "parent": "app/",
      "path": "app/entry.ts",
      "layer": "backend",
      "loc": 10,
      "churn": 0.1,
      "commits": 1,
      "authors": 1,
      "lastChangedAt": "2025-11-01T10:00:00.000Z",
      "description": null,
      "descriptionSource": null
    },
    {
      "id": "ghost/",
      "kind": "module",
      "parent": null,
      "path": "ghost/",
      "layer": "other",
      "loc": 0,
      "churn": 0,
      "commits": 0,
      "authors": 0,
      "lastChangedAt": null,
      "description": null,
      "descriptionSource": null
    }
  ],
  "edges": [],
  "cochanges": []
}
